+ 1.001 /NodeList/2/DeviceList/0/$ns3::CsmaNetDevice/TxQueue/Enqueue ns3::EthernetHeader ( length/type=0x806, source=00:00:00:00:00:04, destination=ff:ff:ff:ff:ff:ff) ns3::ArpHeader (request source mac: 00-06-00:00:00:00:00:04 source ipv4: 10.1.0.2 dest ipv4: 10.1.0.1) Payload (size=18) ns3::EthernetTrailer (fcs=0)
- 1.001 /NodeList/2/DeviceList/0/$ns3::CsmaNetDevice/TxQueue/Dequeue ns3::EthernetHeader ( length/type=0x806, source=00:00:00:00:00:04, destination=ff:ff:ff:ff:ff:ff) ns3::ArpHeader (request source mac: 00-06-00:00:00:00:00:04 source ipv4: 10.1.0.2 dest ipv4: 10.1.0.1) Payload (size=18) ns3::EthernetTrailer (fcs=0)
r 1.00101 /NodeList/0/DeviceList/1/$ns3::CsmaNetDevice/MacRx ns3::EthernetHeader ( length/type=0x806, source=00:00:00:00:00:04, destination=ff:ff:ff:ff:ff:ff) ns3::ArpHeader (request source mac: 00-06-00:00:00:00:00:04 source ipv4: 10.1.0.2 dest ipv4: 10.1.0.1) Payload (size=18) ns3::EthernetTrailer (fcs=0)
+ 1.00101 /NodeList/0/DeviceList/1/$ns3::CsmaNetDevice/TxQueue/Enqueue ns3::EthernetHeader ( length/type=0x806, source=00:00:00:00:00:03, destination=00:00:00:00:00:04) ns3::ArpHeader (reply source mac: 00-06-00:00:00:00:00:03 source ipv4: 10.1.0.1 dest mac: 00-06-00:00:00:00:00:04 dest ipv4: 10.1.0.2) Payload (size=18) ns3::EthernetTrailer (fcs=0)
- 1.00101 /NodeList/0/DeviceList/1/$ns3::CsmaNetDevice/TxQueue/Dequeue ns3::EthernetHeader ( length/type=0x806, source=00:00:00:00:00:03, destination=00:00:00:00:00:04) ns3::ArpHeader (reply source mac: 00-06-00:00:00:00:00:03 source ipv4: 10.1.0.1 dest mac: 00-06-00:00:00:00:00:04 dest ipv4: 10.1.0.2) Payload (size=18) ns3::EthernetTrailer (fcs=0)
r 1.00102 /NodeList/2/DeviceList/0/$ns3::CsmaNetDevice/MacRx ns3::EthernetHeader ( length/type=0x806, source=00:00:00:00:00:03, destination=00:00:00:00:00:04) ns3::ArpHeader (reply source mac: 00-06-00:00:00:00:00:03 source ipv4: 10.1.0.1 dest mac: 00-06-00:00:00:00:00:04 dest ipv4: 10.1.0.2) Payload (size=18) ns3::EthernetTrailer (fcs=0)
+ 1.00102 /NodeList/2/DeviceList/0/$ns3::CsmaNetDevice/TxQueue/Enqueue ns3::EthernetHeader ( length/type=0x800, source=00:00:00:00:00:04, destination=00:00:00:00:00:03) ns3::Ipv4Header (tos 0x0 DSCP Default ECN Not-ECT ttl 64 id 0 protocol 6 offset (bytes) 0 flags [none] length: 56 10.1.0.2 > 10.1.0.1) ns3::TcpHeader (49153 > 8080 [SYN] Seq=0 Ack=0 Win=65535 ns3::TcpOptionTS(1000;0) ns3::TcpOptionWinScale(2) ns3::TcpOptionSackPermitted([sack_perm]) ns3::TcpOptionEnd(EOL)) ns3::EthernetTrailer (fcs=0)
- 1.00102 /NodeList/2/DeviceList/0/$ns3::CsmaNetDevice/TxQueue/Dequeue ns3::EthernetHeader ( length/type=0x800, source=00:00:00:00:00:04, destination=00:00:00:00:00:03) ns3::Ipv4Header (tos 0x0 DSCP Default ECN Not-ECT ttl 64 id 0 protocol 6 offset (bytes) 0 flags [none] length: 56 10.1.0.2 > 10.1.0.1) ns3::TcpHeader (49153 > 8080 [SYN] Seq=0 Ack=0 Win=65535 ns3::TcpOptionTS(1000;0) ns3::TcpOptionWinScale(2) ns3::TcpOptionSackPermitted([sack_perm]) ns3::TcpOptionEnd(EOL)) ns3::EthernetTrailer (fcs=0)
r 1.00104 /NodeList/0/DeviceList/1/$ns3::CsmaNetDevice/MacRx ns3::EthernetHeader ( length/type=0x800, source=00:00:00:00:00:04, destination=00:00:00:00:00:03) ns3::Ipv4Header (tos 0x0 DSCP Default ECN Not-ECT ttl 64 id 0 protocol 6 offset (bytes) 0 flags [none] length: 56 10.1.0.2 > 10.1.0.1) ns3::TcpHeader (49153 > 8080 [SYN] Seq=0 Ack=0 Win=65535 ns3::TcpOptionTS(1000;0) ns3::TcpOptionWinScale(2) ns3::TcpOptionSackPermitted([sack_perm]) ns3::TcpOptionEnd(EOL)) ns3::EthernetTrailer (fcs=0)
+ 1.00704 /NodeList/0/DeviceList/1/$ns3::CsmaNetDevice/TxQueue/Enqueue ns3::EthernetHeader ( length/type=0x806, source=00:00:00:00:00:03, destination=ff:ff:ff:ff:ff:ff) ns3::ArpHeader (request source mac: 00-06-00:00:00:00:00:03 source ipv4: 10.1.0.1 dest ipv4: 10.1.0.2) Payload (size=18) ns3::EthernetTrailer (fcs=0)
- 1.00704 /NodeList/0/DeviceList/1/$ns3::CsmaNetDevice/TxQueue/Dequeue ns3::EthernetHeader ( length/type=0x806, source=00:00:00:00:00:03, destination=ff:ff:ff:ff:ff:ff) ns3::ArpHeader (request source mac: 00-06-00:00:00:00:00:03 source ipv4: 10.1.0.1 dest ipv4: 10.1.0.2) Payload (size=18) ns3::EthernetTrailer (fcs=0)
r 1.00705 /NodeList/2/DeviceList/0/$ns3::CsmaNetDevice/MacRx ns3::EthernetHeader ( length/type=0x806, source=00:00:00:00:00:03, destination=ff:ff:ff:ff:ff:ff) ns3::ArpHeader (request source mac: 00-06-00:00:00:00:00:03 source ipv4: 10.1.0.1 dest ipv4: 10.1.0.2) Payload (size=18) ns3::EthernetTrailer (fcs=0)
+ 1.00705 /NodeList/2/DeviceList/0/$ns3::CsmaNetDevice/TxQueue/Enqueue ns3::EthernetHeader ( length/type=0x806, source=00:00:00:00:00:04, destination=00:00:00:00:00:03) ns3::ArpHeader (reply source mac: 00-06-00:00:00:00:00:04 source ipv4: 10.1.0.2 dest mac: 00-06-00:00:00:00:00:03 dest ipv4: 10.1.0.1) Payload (size=18) ns3::EthernetTrailer (fcs=0)
- 1.00705 /NodeList/2/DeviceList/0/$ns3::CsmaNetDevice/TxQueue/Dequeue ns3::EthernetHeader ( length/type=0x806, source=00:00:00:00:00:04, destination=00:00:00:00:00:03) ns3::ArpHeader (reply source mac: 00-06-00:00:00:00:00:04 source ipv4: 10.1.0.2 dest mac: 00-06-00:00:00:00:00:03 dest ipv4: 10.1.0.1) Payload (size=18) ns3::EthernetTrailer (fcs=0)
r 1.00706 /NodeList/0/DeviceList/1/$ns3::CsmaNetDevice/MacRx ns3::EthernetHeader ( length/type=0x806, source=00:00:00:00:00:04, destination=00:00:00:00:00:03) ns3::ArpHeader (reply source mac: 00-06-00:00:00:00:00:04 source ipv4: 10.1.0.2 dest mac: 00-06-00:00:00:00:00:03 dest ipv4: 10.1.0.1) Payload (size=18) ns3::EthernetTrailer (fcs=0)
+ 1.00706 /NodeList/0/DeviceList/1/$ns3::CsmaNetDevice/TxQueue/Enqueue ns3::EthernetHeader ( length/type=0x800, source=00:00:00:00:00:03, destination=00:00:00:00:00:04) ns3::Ipv4Header (tos 0x0 DSCP Default ECN Not-ECT ttl 64 id 0 protocol 6 offset (bytes) 0 flags [none] length: 56 10.1.0.1 > 10.1.0.2) ns3::TcpHeader (8080 > 49153 [SYN|ACK] Seq=0 Ack=1 Win=65535 ns3::TcpOptionTS(1001;1000) ns3::TcpOptionWinScale(2) ns3::TcpOptionSackPermitted([sack_perm]) ns3::TcpOptionEnd(EOL)) ns3::EthernetTrailer (fcs=0)
- 1.00706 /NodeList/0/DeviceList/1/$ns3::CsmaNetDevice/TxQueue/Dequeue ns3::EthernetHeader ( length/type=0x800, source=00:00:00:00:00:03, destination=00:00:00:00:00:04) ns3::Ipv4Header (tos 0x0 DSCP Default ECN Not-ECT ttl 64 id 0 protocol 6 offset (bytes) 0 flags [none] length: 56 10.1.0.1 > 10.1.0.2) ns3::TcpHeader (8080 > 49153 [SYN|ACK] Seq=0 Ack=1 Win=65535 ns3::TcpOptionTS(1001;1000) ns3::TcpOptionWinScale(2) ns3::TcpOptionSackPermitted([sack_perm]) ns3::TcpOptionEnd(EOL)) ns3::EthernetTrailer (fcs=0)
r 1.00708 /NodeList/2/DeviceList/0/$ns3::CsmaNetDevice/MacRx ns3::EthernetHeader ( length/type=0x800, source=00:00:00:00:00:03, destination=00:00:00:00:00:04) ns3::Ipv4Header (tos 0x0 DSCP Default ECN Not-ECT ttl 64 id 0 protocol 6 offset (bytes) 0 flags [none] length: 56 10.1.0.1 > 10.1.0.2) ns3::TcpHeader (8080 > 49153 [SYN|ACK] Seq=0 Ack=1 Win=65535 ns3::TcpOptionTS(1001;1000) ns3::TcpOptionWinScale(2) ns3::TcpOptionSackPermitted([sack_perm]) ns3::TcpOptionEnd(EOL)) ns3::EthernetTrailer (fcs=0)
+ 1.00708 /NodeList/2/DeviceList/0/$ns3::CsmaNetDevice/TxQueue/Enqueue ns3::EthernetHeader ( length/type=0x800, source=00:00:00:00:00:04, destination=00:00:00:00:00:03) ns3::Ipv4Header (tos 0x0 DSCP Default ECN Not-ECT ttl 64 id 1 protocol 6 offset (bytes) 0 flags [none] length: 52 10.1.0.2 > 10.1.0.1) ns3::TcpHeader (49153 > 8080 [ACK] Seq=1 Ack=1 Win=32768 ns3::TcpOptionTS(1007;1001) ns3::TcpOptionEnd(EOL)) ns3::EthernetTrailer (fcs=0)
- 1.00708 /NodeList/2/DeviceList/0/$ns3::CsmaNetDevice/TxQueue/Dequeue ns3::EthernetHeader ( length/type=0x800, source=00:00:00:00:00:04, destination=00:00:00:00:00:03) ns3::Ipv4Header (tos 0x0 DSCP Default ECN Not-ECT ttl 64 id 1 protocol 6 offset (bytes) 0 flags [none] length: 52 10.1.0.2 > 10.1.0.1) ns3::TcpHeader (49153 > 8080 [ACK] Seq=1 Ack=1 Win=32768 ns3::TcpOptionTS(1007;1001) ns3::TcpOptionEnd(EOL)) ns3::EthernetTrailer (fcs=0)
+ 1.00708 /NodeList/2/DeviceList/0/$ns3::CsmaNetDevice/TxQueue/Enqueue ns3::EthernetHeader ( length/type=0x800, source=00:00:00:00:00:04, destination=00:00:00:00:00:03) ns3::Ipv4Header (tos 0x0 DSCP Default ECN Not-ECT ttl 64 id 2 protocol 6 offset (bytes) 0 flags [none] length: 102 10.1.0.2 > 10.1.0.1) ns3::TcpHeader (49153 > 8080 [ACK] Seq=1 Ack=1 Win=32768 ns3::TcpOptionTS(1007;1001) ns3::TcpOptionEnd(EOL)) Payload (size=50) ns3::EthernetTrailer (fcs=0)
- 1.00708 /NodeList/2/DeviceList/0/$ns3::CsmaNetDevice/TxQueue/Dequeue ns3::EthernetHeader ( length/type=0x800, source=00:00:00:00:00:04, destination=00:00:00:00:00:03) ns3::Ipv4Header (tos 0x0 DSCP Default ECN Not-ECT ttl 64 id 2 protocol 6 offset (bytes) 0 flags [none] length: 102 10.1.0.2 > 10.1.0.1) ns3::TcpHeader (49153 > 8080 [ACK] Seq=1 Ack=1 Win=32768 ns3::TcpOptionTS(1007;1001) ns3::TcpOptionEnd(EOL)) Payload (size=50) ns3::EthernetTrailer (fcs=0)
r 1.00709 /NodeList/0/DeviceList/1/$ns3::CsmaNetDevice/MacRx ns3::EthernetHeader ( length/type=0x800, source=00:00:00:00:00:04, destination=00:00:00:00:00:03) ns3::Ipv4Header (tos 0x0 DSCP Default ECN Not-ECT ttl 64 id 1 protocol 6 offset (bytes) 0 flags [none] length: 52 10.1.0.2 > 10.1.0.1) ns3::TcpHeader (49153 > 8080 [ACK] Seq=1 Ack=1 Win=32768 ns3::TcpOptionTS(1007;1001) ns3::TcpOptionEnd(EOL)) ns3::EthernetTrailer (fcs=0)
r 1.00711 /NodeList/0/DeviceList/1/$ns3::CsmaNetDevice/MacRx ns3::EthernetHeader ( length/type=0x800, source=00:00:00:00:00:04, destination=00:00:00:00:00:03) ns3::Ipv4Header (tos 0x0 DSCP Default ECN Not-ECT ttl 64 id 2 protocol 6 offset (bytes) 0 flags [none] length: 102 10.1.0.2 > 10.1.0.1) ns3::TcpHeader (49153 > 8080 [ACK] Seq=1 Ack=1 Win=32768 ns3::TcpOptionTS(1007;1001) ns3::TcpOptionEnd(EOL)) Payload (size=50) ns3::EthernetTrailer (fcs=0)
+ 1.00711 /NodeList/0/DeviceList/1/$ns3::CsmaNetDevice/TxQueue/Enqueue ns3::EthernetHeader ( length/type=0x800, source=00:00:00:00:00:03, destination=00:00:00:00:00:04) ns3::Ipv4Header (tos 0x0 DSCP Default ECN Not-ECT ttl 64 id 1 protocol 6 offset (bytes) 0 flags [none] length: 52 10.1.0.1 > 10.1.0.2) ns3::TcpHeader (8080 > 49153 [ACK] Seq=1 Ack=51 Win=32768 ns3::TcpOptionTS(1007;1007) ns3::TcpOptionEnd(EOL)) ns3::EthernetTrailer (fcs=0)
- 1.00711 /NodeList/0/DeviceList/1/$ns3::CsmaNetDevice/TxQueue/Dequeue ns3::EthernetHeader ( length/type=0x800, source=00:00:00:00:00:03, destination=00:00:00:00:00:04) ns3::Ipv4Header (tos 0x0 DSCP Default ECN Not-ECT ttl 64 id 1 protocol 6 offset (bytes) 0 flags [none] length: 52 10.1.0.1 > 10.1.0.2) ns3::TcpHeader (8080 > 49153 [ACK] Seq=1 Ack=51 Win=32768 ns3::TcpOptionTS(1007;1007) ns3::TcpOptionEnd(EOL)) ns3::EthernetTrailer (fcs=0)
+ 1.00711 /NodeList/0/DeviceList/1/$ns3::CsmaNetDevice/TxQueue/Enqueue ns3::EthernetHeader ( length/type=0x800, source=00:00:00:00:00:03, destination=00:00:00:00:00:04) ns3::Ipv4Header (tos 0x0 DSCP Default ECN Not-ECT ttl 64 id 2 protocol 6 offset (bytes) 0 flags [none] length: 102 10.1.0.1 > 10.1.0.2) ns3::TcpHeader (8080 > 49153 [ACK] Seq=1 Ack=51 Win=32768 ns3::TcpOptionTS(1007;1007) ns3::TcpOptionEnd(EOL)) Payload (size=50) ns3::EthernetTrailer (fcs=0)
- 1.00712 /NodeList/0/DeviceList/1/$ns3::CsmaNetDevice/TxQueue/Dequeue ns3::EthernetHeader ( length/type=0x800, source=00:00:00:00:00:03, destination=00:00:00:00:00:04) ns3::Ipv4Header (tos 0x0 DSCP Default ECN Not-ECT ttl 64 id 2 protocol 6 offset (bytes) 0 flags [none] length: 102 10.1.0.1 > 10.1.0.2) ns3::TcpHeader (8080 > 49153 [ACK] Seq=1 Ack=51 Win=32768 ns3::TcpOptionTS(1007;1007) ns3::TcpOptionEnd(EOL)) Payload (size=50) ns3::EthernetTrailer (fcs=0)
r 1.00712 /NodeList/2/DeviceList/0/$ns3::CsmaNetDevice/MacRx ns3::EthernetHeader ( length/type=0x800, source=00:00:00:00:00:03, destination=00:00:00:00:00:04) ns3::Ipv4Header (tos 0x0 DSCP Default ECN Not-ECT ttl 64 id 1 protocol 6 offset (bytes) 0 flags [none] length: 52 10.1.0.1 > 10.1.0.2) ns3::TcpHeader (8080 > 49153 [ACK] Seq=1 Ack=51 Win=32768 ns3::TcpOptionTS(1007;1007) ns3::TcpOptionEnd(EOL)) ns3::EthernetTrailer (fcs=0)
r 1.00715 /NodeList/2/DeviceList/0/$ns3::CsmaNetDevice/MacRx ns3::EthernetHeader ( length/type=0x800, source=00:00:00:00:00:03, destination=00:00:00:00:00:04) ns3::Ipv4Header (tos 0x0 DSCP Default ECN Not-ECT ttl 64 id 2 protocol 6 offset (bytes) 0 flags [none] length: 102 10.1.0.1 > 10.1.0.2) ns3::TcpHeader (8080 > 49153 [ACK] Seq=1 Ack=51 Win=32768 ns3::TcpOptionTS(1007;1007) ns3::TcpOptionEnd(EOL)) Payload (size=50) ns3::EthernetTrailer (fcs=0)
+ 1.00715 /NodeList/2/DeviceList/0/$ns3::CsmaNetDevice/TxQueue/Enqueue ns3::EthernetHeader ( length/type=0x800, source=00:00:00:00:00:04, destination=00:00:00:00:00:03) ns3::Ipv4Header (tos 0x0 DSCP Default ECN Not-ECT ttl 64 id 3 protocol 6 offset (bytes) 0 flags [none] length: 52 10.1.0.2 > 10.1.0.1) ns3::TcpHeader (49153 > 8080 [ACK] Seq=51 Ack=51 Win=32768 ns3::TcpOptionTS(1007;1007) ns3::TcpOptionEnd(EOL)) ns3::EthernetTrailer (fcs=0)
- 1.00715 /NodeList/2/DeviceList/0/$ns3::CsmaNetDevice/TxQueue/Dequeue ns3::EthernetHeader ( length/type=0x800, source=00:00:00:00:00:04, destination=00:00:00:00:00:03) ns3::Ipv4Header (tos 0x0 DSCP Default ECN Not-ECT ttl 64 id 3 protocol 6 offset (bytes) 0 flags [none] length: 52 10.1.0.2 > 10.1.0.1) ns3::TcpHeader (49153 > 8080 [ACK] Seq=51 Ack=51 Win=32768 ns3::TcpOptionTS(1007;1007) ns3::TcpOptionEnd(EOL)) ns3::EthernetTrailer (fcs=0)
r 1.00716 /NodeList/0/DeviceList/1/$ns3::CsmaNetDevice/MacRx ns3::EthernetHeader ( length/type=0x800, source=00:00:00:00:00:04, destination=00:00:00:00:00:03) ns3::Ipv4Header (tos 0x0 DSCP Default ECN Not-ECT ttl 64 id 3 protocol 6 offset (bytes) 0 flags [none] length: 52 10.1.0.2 > 10.1.0.1) ns3::TcpHeader (49153 > 8080 [ACK] Seq=51 Ack=51 Win=32768 ns3::TcpOptionTS(1007;1007) ns3::TcpOptionEnd(EOL)) ns3::EthernetTrailer (fcs=0)
+ 1.008 /NodeList/1/DeviceList/0/$ns3::CsmaNetDevice/TxQueue/Enqueue ns3::EthernetHeader ( length/type=0x806, source=00:00:00:00:00:02, destination=ff:ff:ff:ff:ff:ff) ns3::ArpHeader (request source mac: 00-06-00:00:00:00:00:02 source ipv4: 192.168.1.2 dest ipv4: 192.168.1.1) Payload (size=18) ns3::EthernetTrailer (fcs=0)
- 1.008 /NodeList/1/DeviceList/0/$ns3::CsmaNetDevice/TxQueue/Dequeue ns3::EthernetHeader ( length/type=0x806, source=00:00:00:00:00:02, destination=ff:ff:ff:ff:ff:ff) ns3::ArpHeader (request source mac: 00-06-00:00:00:00:00:02 source ipv4: 192.168.1.2 dest ipv4: 192.168.1.1) Payload (size=18) ns3::EthernetTrailer (fcs=0)
r 1.00801 /NodeList/0/DeviceList/0/$ns3::CsmaNetDevice/MacRx ns3::EthernetHeader ( length/type=0x806, source=00:00:00:00:00:02, destination=ff:ff:ff:ff:ff:ff) ns3::ArpHeader (request source mac: 00-06-00:00:00:00:00:02 source ipv4: 192.168.1.2 dest ipv4: 192.168.1.1) Payload (size=18) ns3::EthernetTrailer (fcs=0)
+ 1.00801 /NodeList/0/DeviceList/0/$ns3::CsmaNetDevice/TxQueue/Enqueue ns3::EthernetHeader ( length/type=0x806, source=00:00:00:00:00:01, destination=00:00:00:00:00:02) ns3::ArpHeader (reply source mac: 00-06-00:00:00:00:00:01 source ipv4: 192.168.1.1 dest mac: 00-06-00:00:00:00:00:02 dest ipv4: 192.168.1.2) Payload (size=18) ns3::EthernetTrailer (fcs=0)
- 1.00801 /NodeList/0/DeviceList/0/$ns3::CsmaNetDevice/TxQueue/Dequeue ns3::EthernetHeader ( length/type=0x806, source=00:00:00:00:00:01, destination=00:00:00:00:00:02) ns3::ArpHeader (reply source mac: 00-06-00:00:00:00:00:01 source ipv4: 192.168.1.1 dest mac: 00-06-00:00:00:00:00:02 dest ipv4: 192.168.1.2) Payload (size=18) ns3::EthernetTrailer (fcs=0)
r 1.00802 /NodeList/1/DeviceList/0/$ns3::CsmaNetDevice/MacRx ns3::EthernetHeader ( length/type=0x806, source=00:00:00:00:00:01, destination=00:00:00:00:00:02) ns3::ArpHeader (reply source mac: 00-06-00:00:00:00:00:01 source ipv4: 192.168.1.1 dest mac: 00-06-00:00:00:00:00:02 dest ipv4: 192.168.1.2) Payload (size=18) ns3::EthernetTrailer (fcs=0)
+ 1.00802 /NodeList/1/DeviceList/0/$ns3::CsmaNetDevice/TxQueue/Enqueue ns3::EthernetHeader ( length/type=0x800, source=00:00:00:00:00:02, destination=00:00:00:00:00:01) ns3::Ipv4Header (tos 0x0 DSCP Default ECN Not-ECT ttl 64 id 0 protocol 6 offset (bytes) 0 flags [none] length: 56 192.168.1.2 > 192.168.1.1) ns3::TcpHeader (49153 > 8080 [SYN] Seq=0 Ack=0 Win=65535 ns3::TcpOptionTS(1000;0) ns3::TcpOptionWinScale(2) ns3::TcpOptionSackPermitted([sack_perm]) ns3::TcpOptionEnd(EOL)) ns3::EthernetTrailer (fcs=0)
- 1.00802 /NodeList/1/DeviceList/0/$ns3::CsmaNetDevice/TxQueue/Dequeue ns3::EthernetHeader ( length/type=0x800, source=00:00:00:00:00:02, destination=00:00:00:00:00:01) ns3::Ipv4Header (tos 0x0 DSCP Default ECN Not-ECT ttl 64 id 0 protocol 6 offset (bytes) 0 flags [none] length: 56 192.168.1.2 > 192.168.1.1) ns3::TcpHeader (49153 > 8080 [SYN] Seq=0 Ack=0 Win=65535 ns3::TcpOptionTS(1000;0) ns3::TcpOptionWinScale(2) ns3::TcpOptionSackPermitted([sack_perm]) ns3::TcpOptionEnd(EOL)) ns3::EthernetTrailer (fcs=0)
r 1.00804 /NodeList/0/DeviceList/0/$ns3::CsmaNetDevice/MacRx ns3::EthernetHeader ( length/type=0x800, source=00:00:00:00:00:02, destination=00:00:00:00:00:01) ns3::Ipv4Header (tos 0x0 DSCP Default ECN Not-ECT ttl 64 id 0 protocol 6 offset (bytes) 0 flags [none] length: 56 192.168.1.2 > 192.168.1.1) ns3::TcpHeader (49153 > 8080 [SYN] Seq=0 Ack=0 Win=65535 ns3::TcpOptionTS(1000;0) ns3::TcpOptionWinScale(2) ns3::TcpOptionSackPermitted([sack_perm]) ns3::TcpOptionEnd(EOL)) ns3::EthernetTrailer (fcs=0)
+ 1.01504 /NodeList/0/DeviceList/0/$ns3::CsmaNetDevice/TxQueue/Enqueue ns3::EthernetHeader ( length/type=0x806, source=00:00:00:00:00:01, destination=ff:ff:ff:ff:ff:ff) ns3::ArpHeader (request source mac: 00-06-00:00:00:00:00:01 source ipv4: 192.168.1.1 dest ipv4: 192.168.1.2) Payload (size=18) ns3::EthernetTrailer (fcs=0)
- 1.01504 /NodeList/0/DeviceList/0/$ns3::CsmaNetDevice/TxQueue/Dequeue ns3::EthernetHeader ( length/type=0x806, source=00:00:00:00:00:01, destination=ff:ff:ff:ff:ff:ff) ns3::ArpHeader (request source mac: 00-06-00:00:00:00:00:01 source ipv4: 192.168.1.1 dest ipv4: 192.168.1.2) Payload (size=18) ns3::EthernetTrailer (fcs=0)
r 1.01505 /NodeList/1/DeviceList/0/$ns3::CsmaNetDevice/MacRx ns3::EthernetHeader ( length/type=0x806, source=00:00:00:00:00:01, destination=ff:ff:ff:ff:ff:ff) ns3::ArpHeader (request source mac: 00-06-00:00:00:00:00:01 source ipv4: 192.168.1.1 dest ipv4: 192.168.1.2) Payload (size=18) ns3::EthernetTrailer (fcs=0)
+ 1.01505 /NodeList/1/DeviceList/0/$ns3::CsmaNetDevice/TxQueue/Enqueue ns3::EthernetHeader ( length/type=0x806, source=00:00:00:00:00:02, destination=00:00:00:00:00:01) ns3::ArpHeader (reply source mac: 00-06-00:00:00:00:00:02 source ipv4: 192.168.1.2 dest mac: 00-06-00:00:00:00:00:01 dest ipv4: 192.168.1.1) Payload (size=18) ns3::EthernetTrailer (fcs=0)
- 1.01505 /NodeList/1/DeviceList/0/$ns3::CsmaNetDevice/TxQueue/Dequeue ns3::EthernetHeader ( length/type=0x806, source=00:00:00:00:00:02, destination=00:00:00:00:00:01) ns3::ArpHeader (reply source mac: 00-06-00:00:00:00:00:02 source ipv4: 192.168.1.2 dest mac: 00-06-00:00:00:00:00:01 dest ipv4: 192.168.1.1) Payload (size=18) ns3::EthernetTrailer (fcs=0)
r 1.01506 /NodeList/0/DeviceList/0/$ns3::CsmaNetDevice/MacRx ns3::EthernetHeader ( length/type=0x806, source=00:00:00:00:00:02, destination=00:00:00:00:00:01) ns3::ArpHeader (reply source mac: 00-06-00:00:00:00:00:02 source ipv4: 192.168.1.2 dest mac: 00-06-00:00:00:00:00:01 dest ipv4: 192.168.1.1) Payload (size=18) ns3::EthernetTrailer (fcs=0)
+ 1.01506 /NodeList/0/DeviceList/0/$ns3::CsmaNetDevice/TxQueue/Enqueue ns3::EthernetHeader ( length/type=0x800, source=00:00:00:00:00:01, destination=00:00:00:00:00:02) ns3::Ipv4Header (tos 0x0 DSCP Default ECN Not-ECT ttl 64 id 0 protocol 6 offset (bytes) 0 flags [none] length: 56 192.168.1.1 > 192.168.1.2) ns3::TcpHeader (8080 > 49153 [SYN|ACK] Seq=0 Ack=1 Win=65535 ns3::TcpOptionTS(1008;1000) ns3::TcpOptionWinScale(2) ns3::TcpOptionSackPermitted([sack_perm]) ns3::TcpOptionEnd(EOL)) ns3::EthernetTrailer (fcs=0)
- 1.01506 /NodeList/0/DeviceList/0/$ns3::CsmaNetDevice/TxQueue/Dequeue ns3::EthernetHeader ( length/type=0x800, source=00:00:00:00:00:01, destination=00:00:00:00:00:02) ns3::Ipv4Header (tos 0x0 DSCP Default ECN Not-ECT ttl 64 id 0 protocol 6 offset (bytes) 0 flags [none] length: 56 192.168.1.1 > 192.168.1.2) ns3::TcpHeader (8080 > 49153 [SYN|ACK] Seq=0 Ack=1 Win=65535 ns3::TcpOptionTS(1008;1000) ns3::TcpOptionWinScale(2) ns3::TcpOptionSackPermitted([sack_perm]) ns3::TcpOptionEnd(EOL)) ns3::EthernetTrailer (fcs=0)
r 1.01508 /NodeList/1/DeviceList/0/$ns3::CsmaNetDevice/MacRx ns3::EthernetHeader ( length/type=0x800, source=00:00:00:00:00:01, destination=00:00:00:00:00:02) ns3::Ipv4Header (tos 0x0 DSCP Default ECN Not-ECT ttl 64 id 0 protocol 6 offset (bytes) 0 flags [none] length: 56 192.168.1.1 > 192.168.1.2) ns3::TcpHeader (8080 > 49153 [SYN|ACK] Seq=0 Ack=1 Win=65535 ns3::TcpOptionTS(1008;1000) ns3::TcpOptionWinScale(2) ns3::TcpOptionSackPermitted([sack_perm]) ns3::TcpOptionEnd(EOL)) ns3::EthernetTrailer (fcs=0)
+ 1.01508 /NodeList/1/DeviceList/0/$ns3::CsmaNetDevice/TxQueue/Enqueue ns3::EthernetHeader ( length/type=0x800, source=00:00:00:00:00:02, destination=00:00:00:00:00:01) ns3::Ipv4Header (tos 0x0 DSCP Default ECN Not-ECT ttl 64 id 1 protocol 6 offset (bytes) 0 flags [none] length: 52 192.168.1.2 > 192.168.1.1) ns3::TcpHeader (49153 > 8080 [ACK] Seq=1 Ack=1 Win=32768 ns3::TcpOptionTS(1015;1008) ns3::TcpOptionEnd(EOL)) ns3::EthernetTrailer (fcs=0)
- 1.01508 /NodeList/1/DeviceList/0/$ns3::CsmaNetDevice/TxQueue/Dequeue ns3::EthernetHeader ( length/type=0x800, source=00:00:00:00:00:02, destination=00:00:00:00:00:01) ns3::Ipv4Header (tos 0x0 DSCP Default ECN Not-ECT ttl 64 id 1 protocol 6 offset (bytes) 0 flags [none] length: 52 192.168.1.2 > 192.168.1.1) ns3::TcpHeader (49153 > 8080 [ACK] Seq=1 Ack=1 Win=32768 ns3::TcpOptionTS(1015;1008) ns3::TcpOptionEnd(EOL)) ns3::EthernetTrailer (fcs=0)
+ 1.01508 /NodeList/1/DeviceList/0/$ns3::CsmaNetDevice/TxQueue/Enqueue ns3::EthernetHeader ( length/type=0x800, source=00:00:00:00:00:02, destination=00:00:00:00:00:01) ns3::Ipv4Header (tos 0x0 DSCP Default ECN Not-ECT ttl 64 id 2 protocol 6 offset (bytes) 0 flags [none] length: 102 192.168.1.2 > 192.168.1.1) ns3::TcpHeader (49153 > 8080 [ACK] Seq=1 Ack=1 Win=32768 ns3::TcpOptionTS(1015;1008) ns3::TcpOptionEnd(EOL)) Payload (size=50) ns3::EthernetTrailer (fcs=0)
- 1.01508 /NodeList/1/DeviceList/0/$ns3::CsmaNetDevice/TxQueue/Dequeue ns3::EthernetHeader ( length/type=0x800, source=00:00:00:00:00:02, destination=00:00:00:00:00:01) ns3::Ipv4Header (tos 0x0 DSCP Default ECN Not-ECT ttl 64 id 2 protocol 6 offset (bytes) 0 flags [none] length: 102 192.168.1.2 > 192.168.1.1) ns3::TcpHeader (49153 > 8080 [ACK] Seq=1 Ack=1 Win=32768 ns3::TcpOptionTS(1015;1008) ns3::TcpOptionEnd(EOL)) Payload (size=50) ns3::EthernetTrailer (fcs=0)
r 1.01509 /NodeList/0/DeviceList/0/$ns3::CsmaNetDevice/MacRx ns3::EthernetHeader ( length/type=0x800, source=00:00:00:00:00:02, destination=00:00:00:00:00:01) ns3::Ipv4Header (tos 0x0 DSCP Default ECN Not-ECT ttl 64 id 1 protocol 6 offset (bytes) 0 flags [none] length: 52 192.168.1.2 > 192.168.1.1) ns3::TcpHeader (49153 > 8080 [ACK] Seq=1 Ack=1 Win=32768 ns3::TcpOptionTS(1015;1008) ns3::TcpOptionEnd(EOL)) ns3::EthernetTrailer (fcs=0)
r 1.01511 /NodeList/0/DeviceList/0/$ns3::CsmaNetDevice/MacRx ns3::EthernetHeader ( length/type=0x800, source=00:00:00:00:00:02, destination=00:00:00:00:00:01) ns3::Ipv4Header (tos 0x0 DSCP Default ECN Not-ECT ttl 64 id 2 protocol 6 offset (bytes) 0 flags [none] length: 102 192.168.1.2 > 192.168.1.1) ns3::TcpHeader (49153 > 8080 [ACK] Seq=1 Ack=1 Win=32768 ns3::TcpOptionTS(1015;1008) ns3::TcpOptionEnd(EOL)) Payload (size=50) ns3::EthernetTrailer (fcs=0)
+ 1.01511 /NodeList/0/DeviceList/0/$ns3::CsmaNetDevice/TxQueue/Enqueue ns3::EthernetHeader ( length/type=0x800, source=00:00:00:00:00:01, destination=00:00:00:00:00:02) ns3::Ipv4Header (tos 0x0 DSCP Default ECN Not-ECT ttl 64 id 1 protocol 6 offset (bytes) 0 flags [none] length: 52 192.168.1.1 > 192.168.1.2) ns3::TcpHeader (8080 > 49153 [ACK] Seq=1 Ack=51 Win=32768 ns3::TcpOptionTS(1015;1015) ns3::TcpOptionEnd(EOL)) ns3::EthernetTrailer (fcs=0)
- 1.01511 /NodeList/0/DeviceList/0/$ns3::CsmaNetDevice/TxQueue/Dequeue ns3::EthernetHeader ( length/type=0x800, source=00:00:00:00:00:01, destination=00:00:00:00:00:02) ns3::Ipv4Header (tos 0x0 DSCP Default ECN Not-ECT ttl 64 id 1 protocol 6 offset (bytes) 0 flags [none] length: 52 192.168.1.1 > 192.168.1.2) ns3::TcpHeader (8080 > 49153 [ACK] Seq=1 Ack=51 Win=32768 ns3::TcpOptionTS(1015;1015) ns3::TcpOptionEnd(EOL)) ns3::EthernetTrailer (fcs=0)
+ 1.01511 /NodeList/0/DeviceList/0/$ns3::CsmaNetDevice/TxQueue/Enqueue ns3::EthernetHeader ( length/type=0x800, source=00:00:00:00:00:01, destination=00:00:00:00:00:02) ns3::Ipv4Header (tos 0x0 DSCP Default ECN Not-ECT ttl 64 id 2 protocol 6 offset (bytes) 0 flags [none] length: 102 192.168.1.1 > 192.168.1.2) ns3::TcpHeader (8080 > 49153 [ACK] Seq=1 Ack=51 Win=32768 ns3::TcpOptionTS(1015;1015) ns3::TcpOptionEnd(EOL)) Payload (size=50) ns3::EthernetTrailer (fcs=0)
- 1.01511 /NodeList/0/DeviceList/0/$ns3::CsmaNetDevice/TxQueue/Dequeue ns3::EthernetHeader ( length/type=0x800, source=00:00:00:00:00:01, destination=00:00:00:00:00:02) ns3::Ipv4Header (tos 0x0 DSCP Default ECN Not-ECT ttl 64 id 2 protocol 6 offset (bytes) 0 flags [none] length: 102 192.168.1.1 > 192.168.1.2) ns3::TcpHeader (8080 > 49153 [ACK] Seq=1 Ack=51 Win=32768 ns3::TcpOptionTS(1015;1015) ns3::TcpOptionEnd(EOL)) Payload (size=50) ns3::EthernetTrailer (fcs=0)
r 1.01512 /NodeList/1/DeviceList/0/$ns3::CsmaNetDevice/MacRx ns3::EthernetHeader ( length/type=0x800, source=00:00:00:00:00:01, destination=00:00:00:00:00:02) ns3::Ipv4Header (tos 0x0 DSCP Default ECN Not-ECT ttl 64 id 1 protocol 6 offset (bytes) 0 flags [none] length: 52 192.168.1.1 > 192.168.1.2) ns3::TcpHeader (8080 > 49153 [ACK] Seq=1 Ack=51 Win=32768 ns3::TcpOptionTS(1015;1015) ns3::TcpOptionEnd(EOL)) ns3::EthernetTrailer (fcs=0)
r 1.01514 /NodeList/1/DeviceList/0/$ns3::CsmaNetDevice/MacRx ns3::EthernetHeader ( length/type=0x800, source=00:00:00:00:00:01, destination=00:00:00:00:00:02) ns3::Ipv4Header (tos 0x0 DSCP Default ECN Not-ECT ttl 64 id 2 protocol 6 offset (bytes) 0 flags [none] length: 102 192.168.1.1 > 192.168.1.2) ns3::TcpHeader (8080 > 49153 [ACK] Seq=1 Ack=51 Win=32768 ns3::TcpOptionTS(1015;1015) ns3::TcpOptionEnd(EOL)) Payload (size=50) ns3::EthernetTrailer (fcs=0)
+ 1.01514 /NodeList/1/DeviceList/0/$ns3::CsmaNetDevice/TxQueue/Enqueue ns3::EthernetHeader ( length/type=0x800, source=00:00:00:00:00:02, destination=00:00:00:00:00:01) ns3::Ipv4Header (tos 0x0 DSCP Default ECN Not-ECT ttl 64 id 3 protocol 6 offset (bytes) 0 flags [none] length: 52 192.168.1.2 > 192.168.1.1) ns3::TcpHeader (49153 > 8080 [ACK] Seq=51 Ack=51 Win=32768 ns3::TcpOptionTS(1015;1015) ns3::TcpOptionEnd(EOL)) ns3::EthernetTrailer (fcs=0)
- 1.01514 /NodeList/1/DeviceList/0/$ns3::CsmaNetDevice/TxQueue/Dequeue ns3::EthernetHeader ( length/type=0x800, source=00:00:00:00:00:02, destination=00:00:00:00:00:01) ns3::Ipv4Header (tos 0x0 DSCP Default ECN Not-ECT ttl 64 id 3 protocol 6 offset (bytes) 0 flags [none] length: 52 192.168.1.2 > 192.168.1.1) ns3::TcpHeader (49153 > 8080 [ACK] Seq=51 Ack=51 Win=32768 ns3::TcpOptionTS(1015;1015) ns3::TcpOptionEnd(EOL)) ns3::EthernetTrailer (fcs=0)
r 1.01515 /NodeList/0/DeviceList/0/$ns3::CsmaNetDevice/MacRx ns3::EthernetHeader ( length/type=0x800, source=00:00:00:00:00:02, destination=00:00:00:00:00:01) ns3::Ipv4Header (tos 0x0 DSCP Default ECN Not-ECT ttl 64 id 3 protocol 6 offset (bytes) 0 flags [none] length: 52 192.168.1.2 > 192.168.1.1) ns3::TcpHeader (49153 > 8080 [ACK] Seq=51 Ack=51 Win=32768 ns3::TcpOptionTS(1015;1015) ns3::TcpOptionEnd(EOL)) ns3::EthernetTrailer (fcs=0)
+ 2 /NodeList/1/DeviceList/0/$ns3::CsmaNetDevice/TxQueue/Enqueue ns3::EthernetHeader ( length/type=0x800, source=00:00:00:00:00:02, destination=00:00:00:00:00:01) ns3::Ipv4Header (tos 0x0 DSCP Default ECN Not-ECT ttl 64 id 4 protocol 6 offset (bytes) 0 flags [none] length: 52 192.168.1.2 > 192.168.1.1) ns3::TcpHeader (49153 > 8080 [RST] Seq=51 Ack=51 Win=32768 ns3::TcpOptionTS(2000;1015) ns3::TcpOptionEnd(EOL)) ns3::EthernetTrailer (fcs=0)
- 2 /NodeList/1/DeviceList/0/$ns3::CsmaNetDevice/TxQueue/Dequeue ns3::EthernetHeader ( length/type=0x800, source=00:00:00:00:00:02, destination=00:00:00:00:00:01) ns3::Ipv4Header (tos 0x0 DSCP Default ECN Not-ECT ttl 64 id 4 protocol 6 offset (bytes) 0 flags [none] length: 52 192.168.1.2 > 192.168.1.1) ns3::TcpHeader (49153 > 8080 [RST] Seq=51 Ack=51 Win=32768 ns3::TcpOptionTS(2000;1015) ns3::TcpOptionEnd(EOL)) ns3::EthernetTrailer (fcs=0)
+ 2 /NodeList/2/DeviceList/0/$ns3::CsmaNetDevice/TxQueue/Enqueue ns3::EthernetHeader ( length/type=0x800, source=00:00:00:00:00:04, destination=00:00:00:00:00:03) ns3::Ipv4Header (tos 0x0 DSCP Default ECN Not-ECT ttl 64 id 4 protocol 6 offset (bytes) 0 flags [none] length: 52 10.1.0.2 > 10.1.0.1) ns3::TcpHeader (49153 > 8080 [RST] Seq=51 Ack=51 Win=32768 ns3::TcpOptionTS(2000;1007) ns3::TcpOptionEnd(EOL)) ns3::EthernetTrailer (fcs=0)
- 2 /NodeList/2/DeviceList/0/$ns3::CsmaNetDevice/TxQueue/Dequeue ns3::EthernetHeader ( length/type=0x800, source=00:00:00:00:00:04, destination=00:00:00:00:00:03) ns3::Ipv4Header (tos 0x0 DSCP Default ECN Not-ECT ttl 64 id 4 protocol 6 offset (bytes) 0 flags [none] length: 52 10.1.0.2 > 10.1.0.1) ns3::TcpHeader (49153 > 8080 [RST] Seq=51 Ack=51 Win=32768 ns3::TcpOptionTS(2000;1007) ns3::TcpOptionEnd(EOL)) ns3::EthernetTrailer (fcs=0)
r 2.00001 /NodeList/0/DeviceList/0/$ns3::CsmaNetDevice/MacRx ns3::EthernetHeader ( length/type=0x800, source=00:00:00:00:00:02, destination=00:00:00:00:00:01) ns3::Ipv4Header (tos 0x0 DSCP Default ECN Not-ECT ttl 64 id 4 protocol 6 offset (bytes) 0 flags [none] length: 52 192.168.1.2 > 192.168.1.1) ns3::TcpHeader (49153 > 8080 [RST] Seq=51 Ack=51 Win=32768 ns3::TcpOptionTS(2000;1015) ns3::TcpOptionEnd(EOL)) ns3::EthernetTrailer (fcs=0)
r 2.00001 /NodeList/0/DeviceList/1/$ns3::CsmaNetDevice/MacRx ns3::EthernetHeader ( length/type=0x800, source=00:00:00:00:00:04, destination=00:00:00:00:00:03) ns3::Ipv4Header (tos 0x0 DSCP Default ECN Not-ECT ttl 64 id 4 protocol 6 offset (bytes) 0 flags [none] length: 52 10.1.0.2 > 10.1.0.1) ns3::TcpHeader (49153 > 8080 [RST] Seq=51 Ack=51 Win=32768 ns3::TcpOptionTS(2000;1007) ns3::TcpOptionEnd(EOL)) ns3::EthernetTrailer (fcs=0)
+ 3 /NodeList/1/DeviceList/0/$ns3::CsmaNetDevice/TxQueue/Enqueue ns3::EthernetHeader ( length/type=0x800, source=00:00:00:00:00:02, destination=00:00:00:00:00:01) ns3::Ipv4Header (tos 0x0 DSCP Default ECN Not-ECT ttl 64 id 5 protocol 6 offset (bytes) 0 flags [none] length: 56 192.168.1.2 > 192.168.1.1) ns3::TcpHeader (49154 > 8080 [SYN] Seq=51 Ack=51 Win=65535 ns3::TcpOptionTS(3000;1015) ns3::TcpOptionWinScale(2) ns3::TcpOptionSackPermitted([sack_perm]) ns3::TcpOptionEnd(EOL)) ns3::EthernetTrailer (fcs=0)
- 3 /NodeList/1/DeviceList/0/$ns3::CsmaNetDevice/TxQueue/Dequeue ns3::EthernetHeader ( length/type=0x800, source=00:00:00:00:00:02, destination=00:00:00:00:00:01) ns3::Ipv4Header (tos 0x0 DSCP Default ECN Not-ECT ttl 64 id 5 protocol 6 offset (bytes) 0 flags [none] length: 56 192.168.1.2 > 192.168.1.1) ns3::TcpHeader (49154 > 8080 [SYN] Seq=51 Ack=51 Win=65535 ns3::TcpOptionTS(3000;1015) ns3::TcpOptionWinScale(2) ns3::TcpOptionSackPermitted([sack_perm]) ns3::TcpOptionEnd(EOL)) ns3::EthernetTrailer (fcs=0)
+ 3 /NodeList/2/DeviceList/0/$ns3::CsmaNetDevice/TxQueue/Enqueue ns3::EthernetHeader ( length/type=0x800, source=00:00:00:00:00:04, destination=00:00:00:00:00:03) ns3::Ipv4Header (tos 0x0 DSCP Default ECN Not-ECT ttl 64 id 5 protocol 6 offset (bytes) 0 flags [none] length: 56 10.1.0.2 > 10.1.0.1) ns3::TcpHeader (49154 > 8080 [SYN] Seq=51 Ack=51 Win=65535 ns3::TcpOptionTS(3000;1007) ns3::TcpOptionWinScale(2) ns3::TcpOptionSackPermitted([sack_perm]) ns3::TcpOptionEnd(EOL)) ns3::EthernetTrailer (fcs=0)
- 3 /NodeList/2/DeviceList/0/$ns3::CsmaNetDevice/TxQueue/Dequeue ns3::EthernetHeader ( length/type=0x800, source=00:00:00:00:00:04, destination=00:00:00:00:00:03) ns3::Ipv4Header (tos 0x0 DSCP Default ECN Not-ECT ttl 64 id 5 protocol 6 offset (bytes) 0 flags [none] length: 56 10.1.0.2 > 10.1.0.1) ns3::TcpHeader (49154 > 8080 [SYN] Seq=51 Ack=51 Win=65535 ns3::TcpOptionTS(3000;1007) ns3::TcpOptionWinScale(2) ns3::TcpOptionSackPermitted([sack_perm]) ns3::TcpOptionEnd(EOL)) ns3::EthernetTrailer (fcs=0)
r 3.00001 /NodeList/0/DeviceList/0/$ns3::CsmaNetDevice/MacRx ns3::EthernetHeader ( length/type=0x800, source=00:00:00:00:00:02, destination=00:00:00:00:00:01) ns3::Ipv4Header (tos 0x0 DSCP Default ECN Not-ECT ttl 64 id 5 protocol 6 offset (bytes) 0 flags [none] length: 56 192.168.1.2 > 192.168.1.1) ns3::TcpHeader (49154 > 8080 [SYN] Seq=51 Ack=51 Win=65535 ns3::TcpOptionTS(3000;1015) ns3::TcpOptionWinScale(2) ns3::TcpOptionSackPermitted([sack_perm]) ns3::TcpOptionEnd(EOL)) ns3::EthernetTrailer (fcs=0)
r 3.00001 /NodeList/0/DeviceList/1/$ns3::CsmaNetDevice/MacRx ns3::EthernetHeader ( length/type=0x800, source=00:00:00:00:00:04, destination=00:00:00:00:00:03) ns3::Ipv4Header (tos 0x0 DSCP Default ECN Not-ECT ttl 64 id 5 protocol 6 offset (bytes) 0 flags [none] length: 56 10.1.0.2 > 10.1.0.1) ns3::TcpHeader (49154 > 8080 [SYN] Seq=51 Ack=51 Win=65535 ns3::TcpOptionTS(3000;1007) ns3::TcpOptionWinScale(2) ns3::TcpOptionSackPermitted([sack_perm]) ns3::TcpOptionEnd(EOL)) ns3::EthernetTrailer (fcs=0)
+ 3.00001 /NodeList/0/DeviceList/0/$ns3::CsmaNetDevice/TxQueue/Enqueue ns3::EthernetHeader ( length/type=0x800, source=00:00:00:00:00:01, destination=00:00:00:00:00:02) ns3::Ipv4Header (tos 0x0 DSCP Default ECN Not-ECT ttl 64 id 3 protocol 6 offset (bytes) 0 flags [none] length: 56 192.168.1.1 > 192.168.1.2) ns3::TcpHeader (8080 > 49154 [SYN|ACK] Seq=0 Ack=52 Win=65535 ns3::TcpOptionTS(3000;1000) ns3::TcpOptionWinScale(2) ns3::TcpOptionSackPermitted([sack_perm]) ns3::TcpOptionEnd(EOL)) ns3::EthernetTrailer (fcs=0)
- 3.00001 /NodeList/0/DeviceList/0/$ns3::CsmaNetDevice/TxQueue/Dequeue ns3::EthernetHeader ( length/type=0x800, source=00:00:00:00:00:01, destination=00:00:00:00:00:02) ns3::Ipv4Header (tos 0x0 DSCP Default ECN Not-ECT ttl 64 id 3 protocol 6 offset (bytes) 0 flags [none] length: 56 192.168.1.1 > 192.168.1.2) ns3::TcpHeader (8080 > 49154 [SYN|ACK] Seq=0 Ack=52 Win=65535 ns3::TcpOptionTS(3000;1000) ns3::TcpOptionWinScale(2) ns3::TcpOptionSackPermitted([sack_perm]) ns3::TcpOptionEnd(EOL)) ns3::EthernetTrailer (fcs=0)
+ 3.00001 /NodeList/0/DeviceList/1/$ns3::CsmaNetDevice/TxQueue/Enqueue ns3::EthernetHeader ( length/type=0x800, source=00:00:00:00:00:03, destination=00:00:00:00:00:04) ns3::Ipv4Header (tos 0x0 DSCP Default ECN Not-ECT ttl 64 id 3 protocol 6 offset (bytes) 0 flags [none] length: 56 10.1.0.1 > 10.1.0.2) ns3::TcpHeader (8080 > 49154 [SYN|ACK] Seq=0 Ack=52 Win=65535 ns3::TcpOptionTS(3000;1000) ns3::TcpOptionWinScale(2) ns3::TcpOptionSackPermitted([sack_perm]) ns3::TcpOptionEnd(EOL)) ns3::EthernetTrailer (fcs=0)
- 3.00001 /NodeList/0/DeviceList/1/$ns3::CsmaNetDevice/TxQueue/Dequeue ns3::EthernetHeader ( length/type=0x800, source=00:00:00:00:00:03, destination=00:00:00:00:00:04) ns3::Ipv4Header (tos 0x0 DSCP Default ECN Not-ECT ttl 64 id 3 protocol 6 offset (bytes) 0 flags [none] length: 56 10.1.0.1 > 10.1.0.2) ns3::TcpHeader (8080 > 49154 [SYN|ACK] Seq=0 Ack=52 Win=65535 ns3::TcpOptionTS(3000;1000) ns3::TcpOptionWinScale(2) ns3::TcpOptionSackPermitted([sack_perm]) ns3::TcpOptionEnd(EOL)) ns3::EthernetTrailer (fcs=0)
r 3.00002 /NodeList/1/DeviceList/0/$ns3::CsmaNetDevice/MacRx ns3::EthernetHeader ( length/type=0x800, source=00:00:00:00:00:01, destination=00:00:00:00:00:02) ns3::Ipv4Header (tos 0x0 DSCP Default ECN Not-ECT ttl 64 id 3 protocol 6 offset (bytes) 0 flags [none] length: 56 192.168.1.1 > 192.168.1.2) ns3::TcpHeader (8080 > 49154 [SYN|ACK] Seq=0 Ack=52 Win=65535 ns3::TcpOptionTS(3000;1000) ns3::TcpOptionWinScale(2) ns3::TcpOptionSackPermitted([sack_perm]) ns3::TcpOptionEnd(EOL)) ns3::EthernetTrailer (fcs=0)
+ 3.00002 /NodeList/1/DeviceList/0/$ns3::CsmaNetDevice/TxQueue/Enqueue ns3::EthernetHeader ( length/type=0x800, source=00:00:00:00:00:02, destination=00:00:00:00:00:01) ns3::Ipv4Header (tos 0x0 DSCP Default ECN Not-ECT ttl 64 id 6 protocol 6 offset (bytes) 0 flags [none] length: 52 192.168.1.2 > 192.168.1.1) ns3::TcpHeader (49154 > 8080 [ACK] Seq=52 Ack=1 Win=32768 ns3::TcpOptionTS(3000;1015) ns3::TcpOptionEnd(EOL)) ns3::EthernetTrailer (fcs=0)
- 3.00002 /NodeList/1/DeviceList/0/$ns3::CsmaNetDevice/TxQueue/Dequeue ns3::EthernetHeader ( length/type=0x800, source=00:00:00:00:00:02, destination=00:00:00:00:00:01) ns3::Ipv4Header (tos 0x0 DSCP Default ECN Not-ECT ttl 64 id 6 protocol 6 offset (bytes) 0 flags [none] length: 52 192.168.1.2 > 192.168.1.1) ns3::TcpHeader (49154 > 8080 [ACK] Seq=52 Ack=1 Win=32768 ns3::TcpOptionTS(3000;1015) ns3::TcpOptionEnd(EOL)) ns3::EthernetTrailer (fcs=0)
+ 3.00002 /NodeList/1/DeviceList/0/$ns3::CsmaNetDevice/TxQueue/Enqueue ns3::EthernetHeader ( length/type=0x800, source=00:00:00:00:00:02, destination=00:00:00:00:00:01) ns3::Ipv4Header (tos 0x0 DSCP Default ECN Not-ECT ttl 64 id 7 protocol 6 offset (bytes) 0 flags [none] length: 102 192.168.1.2 > 192.168.1.1) ns3::TcpHeader (49154 > 8080 [ACK] Seq=52 Ack=1 Win=32768 ns3::TcpOptionTS(3000;1015) ns3::TcpOptionEnd(EOL)) Payload (size=50) ns3::EthernetTrailer (fcs=0)
r 3.00002 /NodeList/2/DeviceList/0/$ns3::CsmaNetDevice/MacRx ns3::EthernetHeader ( length/type=0x800, source=00:00:00:00:00:03, destination=00:00:00:00:00:04) ns3::Ipv4Header (tos 0x0 DSCP Default ECN Not-ECT ttl 64 id 3 protocol 6 offset (bytes) 0 flags [none] length: 56 10.1.0.1 > 10.1.0.2) ns3::TcpHeader (8080 > 49154 [SYN|ACK] Seq=0 Ack=52 Win=65535 ns3::TcpOptionTS(3000;1000) ns3::TcpOptionWinScale(2) ns3::TcpOptionSackPermitted([sack_perm]) ns3::TcpOptionEnd(EOL)) ns3::EthernetTrailer (fcs=0)
+ 3.00002 /NodeList/2/DeviceList/0/$ns3::CsmaNetDevice/TxQueue/Enqueue ns3::EthernetHeader ( length/type=0x800, source=00:00:00:00:00:04, destination=00:00:00:00:00:03) ns3::Ipv4Header (tos 0x0 DSCP Default ECN Not-ECT ttl 64 id 6 protocol 6 offset (bytes) 0 flags [none] length: 52 10.1.0.2 > 10.1.0.1) ns3::TcpHeader (49154 > 8080 [ACK] Seq=52 Ack=1 Win=32768 ns3::TcpOptionTS(3000;1007) ns3::TcpOptionEnd(EOL)) ns3::EthernetTrailer (fcs=0)
- 3.00002 /NodeList/2/DeviceList/0/$ns3::CsmaNetDevice/TxQueue/Dequeue ns3::EthernetHeader ( length/type=0x800, source=00:00:00:00:00:04, destination=00:00:00:00:00:03) ns3::Ipv4Header (tos 0x0 DSCP Default ECN Not-ECT ttl 64 id 6 protocol 6 offset (bytes) 0 flags [none] length: 52 10.1.0.2 > 10.1.0.1) ns3::TcpHeader (49154 > 8080 [ACK] Seq=52 Ack=1 Win=32768 ns3::TcpOptionTS(3000;1007) ns3::TcpOptionEnd(EOL)) ns3::EthernetTrailer (fcs=0)
+ 3.00002 /NodeList/2/DeviceList/0/$ns3::CsmaNetDevice/TxQueue/Enqueue ns3::EthernetHeader ( length/type=0x800, source=00:00:00:00:00:04, destination=00:00:00:00:00:03) ns3::Ipv4Header (tos 0x0 DSCP Default ECN Not-ECT ttl 64 id 7 protocol 6 offset (bytes) 0 flags [none] length: 102 10.1.0.2 > 10.1.0.1) ns3::TcpHeader (49154 > 8080 [ACK] Seq=52 Ack=1 Win=32768 ns3::TcpOptionTS(3000;1007) ns3::TcpOptionEnd(EOL)) Payload (size=50) ns3::EthernetTrailer (fcs=0)
- 3.00003 /NodeList/1/DeviceList/0/$ns3::CsmaNetDevice/TxQueue/Dequeue ns3::EthernetHeader ( length/type=0x800, source=00:00:00:00:00:02, destination=00:00:00:00:00:01) ns3::Ipv4Header (tos 0x0 DSCP Default ECN Not-ECT ttl 64 id 7 protocol 6 offset (bytes) 0 flags [none] length: 102 192.168.1.2 > 192.168.1.1) ns3::TcpHeader (49154 > 8080 [ACK] Seq=52 Ack=1 Win=32768 ns3::TcpOptionTS(3000;1015) ns3::TcpOptionEnd(EOL)) Payload (size=50) ns3::EthernetTrailer (fcs=0)
